{
  "name": "PATCH raw text body",
  "method": "PATCH",
  "url": "{{baseUrl}}/patch",
  "headers": [
    {
      "name": "accept",
      "value": "application/json",
      "enabled": true
    }
  ],
  "body": {
    "type": "raw",
    "contentType": "text/plain",
    "content": "ReadableHttp raw body sample"
  }
}
